9759,106548.0,Total War: Warhammer II - Serpent God Edition,"As the twin-tailed comet arcs across the sky, those attuned to the Winds of Magic feel the air buckle with arcane energies. In torch-lit temple halls, fervent priests trace cobweb-threads of ancient geomancy, bowing their heads in fervent anticipation...
All who know agree - a change is coming.

From the thundering clouds of battle, a new god rears its scaled head. Sotek, the deliverer, god of Serpents and of War, has arrived.

Truly an edition fit for a god, or at the very least a devoted high-priest, the Serpent God Edition comes wrapped in faux lizard skin, replete with stone effect glyphs modeled on Lord Mazdamundi's headdress, detailing the temple-cities of Lustria.",2017.0,89.87,1,0,0,0,0,0,0,0,0,0,0,0,0,1,0,0,0,0,1,0,0,0,0,0,0,0,0,0,0,0,0,0,0,0,0,0,0,0,0,0,0,0,0,0,0,0,0,0,0,0,0,0,0,0,0,0,0,0,0,0,0,0,0,0,0,0,0,0,0,0,0,0,0,0,0,0,0,0,0,0,0,0,0,0,0,1,0,0,0,0,0,0,0,0,0,0,0,0,0,0,0,0,0,0,0,0,0,0,0,0,0,0,0,0,0,0,0,0,0,0,0,0,0,0,0,0,0,0,0,1,1,0
9789,71529.0,RimWorld,"A sci-fi colony sim driven by an intelligent AI storyteller. Generates stories by simulating psychology, ecology, gunplay, melee combat, climate, biomes, diplomacy, interpersonal relationships, art, medicine, trade, and more.",2018.0,80.61,0,0,0,0,0,1,0,0,0,0,0,0,0,1,0,0,1,0,1,0,0,0,0,0,0,0,0,0,0,0,0,0,0,0,0,0,0,0,0,0,0,0,0,0,0,0,0,0,0,0,0,0,0,0,0,0,0,0,0,0,0,1,0,0,1,0,0,0,0,0,0,0,0,0,0,0,0,0,0,0,0,0,0,0,0,1,0,0,0,0,0,0,0,0,0,0,0,0,0,0,0,0,0,0,0,0,0,0,0,0,0,0,0,0,0,0,0,0,0,0,0,0,0,0,0,0,0,0,0,0,1,0
9808,99257.0,Vertical Drop Heroes HD,"Vertical Drop Heroes is a procedural platformer RPG hybrid with roguelike elements, where your hero adventures through randomly generated stages. Armed with a variety of skills and traits, you must use your cunning and reflexes to survive the dangers of each stage, until you face the final boss and uncover the truth behind the game!",2014.0,79.51,1,0,0,0,0,1,0,0,1,0,0,0,0,0,1,0,0,0,1,0,0,0,0,0,0,0,0,0,0,0,0,0,0,0,0,0,0,0,0,0,0,0,0,0,0,0,0,0,0,0,0,0,0,0,0,0,0,0,0,0,0,0,0,0,1,0,0,0,0,0,0,0,0,0,0,0,0,1,0,0,0,0,0,0,0,1,0,0,0,0,0,0,1,0,0,0,1,0,0,0,0,0,0,0,0,0,0,0,0,0,0,0,0,0,0,0,0,0,0,0,0,0,1,0,0,0,0,1,0,1,1,1
9809,126768.0,Creeper World 3: Arc Eternal,"For billions of years empires rose to greatness. Each fell to the Creeper till none remained. Now all hope appears lost. Who will stand against the Creeper? Experience this extreme and massive expansion of the Creeper World franchise. Nothing will ever be the same... Massive maps, custom units scripting, terraforming, Gravatars? Can you handle the challenge?",2014.0,89.98,0,0,0,0,0,1,0,0,0,0,1,0,0,1,0,0,1,0,1,0,0,0,0,0,0,0,0,0,0,0,0,0,0,0,0,0,0,0,0,0,0,0,0,0,0,0,0,0,0,0,0,0,0,0,0,0,0,0,0,0,0,0,0,0,0,0,0,0,0,0,0,0,0,0,0,0,0,0,0,0,0,0,0,0,0,1,0,0,0,0,0,0,0,0,0,0,0,0,0,0,0,0,0,0,0,0,0,0,0,0,0,0,0,0,0,0,0,0,0,0,0,0,0,0,0,0,0,0,0,0,1,0
9833,96083.0,Warlords Battlecry II,"The game is set within the world of Etheria. In the campaign the player must take control of one of the twelve races and capture all sixty-seven regions of the land in a non-linear manner. The player does this whilst assuming the role of a ""Hero"" which he or she has created. There are twelve different playable races, each with their own type of Hero, buildings and resource dependencies.",2002.0,85.25,0,0,0,0,0,0,0,0,0,0,0,0,0,1,1,0,1,0,1,0,0,0,0,0,0,0,0,0,0,0,0,0,0,0,0,0,0,0,0,0,0,0,0,0,0,0,0,0,0,0,0,0,0,0,0,0,0,0,0,0,0,0,0,0,0,0,0,0,0,0,0,0,0,0,0,0,0,0,0,0,0,0,0,0,0,1,0,0,0,0,0,0,0,0,0,0,0,0,0,0,0,0,0,0,0,0,0,0,0,0,0,0,0,0,0,0,0,0,0,0,0,0,0,0,0,0,0,0,0,1,1,0
9834,82271.0,Warlords Battlecry III,"Warlords Battlecry III further expands the Battlecry tradition of featuring persistent RPG-like fantasy heroes with its retinue of loyal followers fighting massive battles in the Warlords' world of Etheria. It is a true sequel to Warlords Battlecry I & II, featuring many familiar races and troop-types, while also adding some new ones into the mix. 

Warlords Battlecry III continue to perfect its automated feature system, greatly reducing gameplay micromanagement and quickly proving to be the holy grail of RTS games among gamers of the genre. 

While being a strong RTS outright, there are also numerous activities for players to engage in between battles, such as obtaining titles and awards, trading and purchasing items & retinue members, and even an upgradeable castle to reflect your importance and influence in the world of Etheria. 

Extra features included in Warlords Battlecry III are specifically geared to please the legions of previous Battlecry players, including the removal of hero and unit caps, the addition of new special abilities for high-level heroes and the creation of an intuitive hero system. All of these features, coupled with new races and hero classes, new spells and items, and new building and dragons meld to form a Real-Time Strategy game that once again raises the benchmark for other games in the genre. Warlords Battlecry III is poised to receive even greater accolades than the previous award-winning titles in the Warlords Battlecry series.",2004.0,87.46,0,0,0,0,0,0,0,0,0,0,0,0,0,1,1,0,0,0,1,0,0,0,0,0,0,0,0,0,0,0,0,0,0,0,0,0,0,0,0,0,0,0,0,0,0,0,0,0,0,0,0,0,0,0,0,0,0,0,0,0,0,0,0,0,0,0,0,0,0,0,0,0,0,0,0,0,0,0,0,0,0,0,0,0,0,1,0,0,0,0,0,0,0,0,0,0,0,0,0,0,0,0,0,0,0,0,0,0,0,0,0,0,0,0,0,0,0,0,0,0,0,0,0,0,0,0,0,0,0,1,1,0
9840,118260.0,Fieldrunners 2,"Strategic-Action-Puzzle-Defense has never been this fun and addicting! Defend your world from the invasion by building winding paths out of imaginative, new weapons. Over 20 new levels span the grassiest fields, driest deserts, sparkling cities, and even an infernal volcano lair! Are you ready to stop the Fieldrunners once and for all? Join the defense, now!",2012.0,85.99,0,0,0,0,0,1,0,0,0,0,0,0,0,0,0,0,0,0,1,0,0,0,0,0,0,0,0,0,0,1,0,0,0,0,0,0,0,0,0,1,0,0,0,0,0,0,0,0,0,0,0,0,0,0,0,0,0,0,0,0,0,0,0,0,0,0,0,0,0,0,0,0,0,0,0,0,0,0,0,0,0,0,0,0,0,1,0,0,0,0,0,0,0,0,0,0,1,0,0,0,0,0,0,0,0,0,0,0,0,0,0,0,0,0,0,0,0,0,0,0,0,0,0,0,0,1,0,0,0,0,1,0
9894,182329.0,1nsane,"Levels are set in real world locations, scattered throughout North America, Europe, Africa, Asia and Australia. The actual design, however, is fictitious.

The single player campaign comprises a series of championships in different vehicle classes, where the player unlocks new vehicles and locations, based on their score.

Vehicles range from utility vehicles to light buggies and are either fictional or inspired by actual production vehicles. Though the names do not correspond with any actual vehicle, the fact is evident both visually in-game and in the names of the game's files.",2000.0,89.97,0,1,0,0,0,0,0,0,0,0,0,0,1,0,0,0,0,0,0,0,0,0,0,0,0,0,0,0,0,0,0,0,0,0,0,0,0,0,0,0,0,0,0,0,0,0,0,0,0,0,0,0,0,0,0,0,0,0,0,0,0,0,0,0,0,0,0,0,0,0,0,0,0,0,0,0,0,0,0,0,0,0,0,0,0,1,0,0,0,0,0,0,0,0,0,0,0,0,0,0,0,0,0,0,0,0,0,0,0,0,0,0,0,0,0,0,0,0,0,0,0,0,0,0,0,0,0,0,0,1,1,1
9898,129240.0,Total War: Warhammer,"A unique combination of colossal real-time battles and an addictive turn-based sandbox campaign game of statecraft, politics and empire building, Total War: WARHAMMER will deliver hundreds of hours of absorbing gameplay.

What is more, this title will go on to combine with two further standalone instalments and additional content packs to create the largest Total War experience ever. An epic trilogy of titles that will redefine fantasy strategy gaming.

This is the dawn of a new era. Total War: WARHAMMER brings to life a world of legendary heroes, towering monsters, flying creatures, storms of magical power and regiments of nightmarish warriors.",2016.0,86.91,0,0,0,0,0,0,0,0,0,0,0,0,0,1,1,0,0,0,1,0,1,0,0,0,0,0,0,0,0,0,0,0,0,0,0,0,0,0,0,0,0,0,0,0,0,0,0,0,0,0,0,0,0,0,0,0,0,0,0,0,0,1,0,0,1,0,0,0,0,0,0,0,0,0,0,0,0,0,0,0,0,0,0,0,0,1,0,0,0,0,0,0,0,0,0,0,0,0,0,0,0,0,0,0,0,0,0,0,0,0,0,0,0,0,0,0,0,0,0,0,0,0,0,0,0,0,0,1,0,1,1,0
9927,81906.0,Persona 5,"Persona 5, a turn-based JRPG with visual novel elements, follows a high school student with a criminal record for a crime he didn't commit. Soon he meets several characters who share similar fates to him, and discovers a metaphysical realm which allows him and his friends to channel their pent-up frustrations into becoming a group of vigilantes reveling in aesthetics and rebellion while fighting corruption.",2016.0,93.95,1,0,0,0,0,0,0,0,0,0,0,0,0,0,1,0,0,0,0,0,1,0,0,0,0,0,0,0,0,0,0,0,0,0,0,0,0,0,0,0,0,0,0,0,0,0,0,0,0,0,0,0,0,0,0,0,0,0,0,0,0,0,0,0,0,0,0,0,0,0,0,0,0,0,0,0,0,0,0,0,0,0,0,0,0,0,0,0,0,0,0,1,1,0,0,0,0,0,0,0,0,0,0,0,0,0,0,0,0,0,0,0,0,0,0,0,0,0,0,0,0,0,0,0,0,0,0,0,0,0,1,0
10107,126744.0,Corsairs: Conquest at Sea,"Corsairs: Conquest at Sea is a 1999 strategy/action/adventure game for the PC, developed and published by Microïds (known for Syberia and its continuation Syberia II). The game is a simulation of the life of a privateer employed by either England, France, The Netherlands or Spain in, most likely, the 17th century. The player can take part in either the campaign, which consists of several scenarios with a specific goal, or adventure mode, where the goal is simply to capture all the ports on the map for your nation.",1999.0,91.14,0,0,0,0,0,0,0,0,0,0,0,0,0,1,0,0,0,0,1,0,0,0,0,0,0,0,0,0,0,0,0,0,0,0,0,0,0,0,0,0,0,0,0,0,0,0,0,0,0,0,0,0,0,0,0,0,0,0,0,0,0,0,0,0,0,0,0,0,0,0,0,0,0,0,0,0,0,0,0,0,0,0,0,0,0,1,0,0,0,0,0,0,0,0,0,0,0,0,0,0,0,0,0,0,0,0,0,0,0,0,0,0,0,0,0,0,0,0,0,0,0,0,0,0,0,0,0,0,0,0,1,0
10166,171276.0,Dark Void Zero,"Rise On! After 20 years, the legendary lost project “Dark Void” is back! To commemorate the game’s humble origins, Capcom has commissioned the recreation of the original 8-bit classic, now re-titled “Dark Void Zero”.

In this critically acclaimed 8-bit de-make, you play as Rusty, warrior test-pilot and Nikola Tesla’s trusted friend. With the help of your state-of-the-art rocket pack, blast through three deliciously retro levels of baddies in your quest to close Portal X and save the human race!",2010.0,86.0,1,0,0,0,0,0,0,0,1,0,0,0,0,0,0,1,0,0,0,0,0,0,0,0,0,0,0,0,0,0,0,0,0,0,0,0,0,0,0,0,0,0,0,0,0,0,0,0,0,0,0,0,0,0,0,0,0,0,0,0,0,0,0,0,0,0,0,0,0,0,0,0,0,1,1,0,0,0,0,0,0,0,0,0,0,1,0,0,0,0,0,0,0,0,0,0,0,0,0,0,0,0,0,0,0,0,0,0,0,0,0,0,0,0,0,0,0,0,0,0,0,0,0,0,0,1,0,0,0,0,1,0
10175,99709.0,Decay: The Mare,"A new psychological horror adventure game from the creators of the successful Decay series: Sam is an addict who ends up in an institution named “Reaching Dreams”, hoping to kick his drug problem and sort out his miserable life. But during the first night, something goes horribly wrong and he gets stuck in an endless nightmare…

Decay – The Mare is a 3D psychological horror adventure and homage to the Resident Evil and Silent Hill games, as well as to horror adventure games like Phantasmagoria, The 11th Hour and Gabriel Knight.

For the first time the compelling, high-tension Adventure is available in one package, including an exclusive third chapter that will bring Sam’s journey to an end.

Decay’s developer Shining Gate Software is a small indie studio located in Stockholm, Sweden. The studio is best known for their work with DICE and Electronic Arts on the Battlefield franchise and for their own Decay series, released on multiple platforms.",2015.0,90.0,1,0,0,0,0,1,0,0,0,0,0,0,0,0,0,0,0,0,0,0,0,0,0,0,0,0,0,0,0,0,0,0,0,0,0,0,0,0,0,0,0,0,0,0,0,0,0,0,0,0,0,0,0,0,0,0,0,0,0,0,0,1,0,0,1,0,0,0,0,0,0,0,0,0,0,0,0,0,0,0,0,0,0,0,0,1,0,0,0,0,0,0,0,0,0,0,0,0,0,0,0,0,0,0,0,0,0,0,0,0,0,0,0,0,0,0,0,0,0,0,0,0,1,0,0,0,0,0,0,0,1,0
10222,140639.0,The Revenge of Shinobi,"Set in the mythical world of ancient Japan, players take on the role of ninja warrior Shinobi. To free the world from the curse of Goaku, Shinobi must recover 5 elemental swords and defeat the Shoguns who wield them. It will take stealth, strength, and the mastery of the mystic arts for Shinobi to battle his way through the 5 lands.

While the game shares a name with the third game in the Shinobi series, it's a stand-alone spin-off title not based on the previous game.",2002.0,87.0,0,0,0,0,1,0,0,0,0,0,0,0,0,0,0,0,0,0,0,0,0,0,0,0,0,0,0,0,0,0,0,0,0,0,0,0,0,0,0,0,0,0,0,0,0,0,0,0,0,0,0,0,0,0,0,1,0,0,0,0,0,0,0,0,0,0,0,0,0,0,0,0,0,0,0,0,0,0,0,0,0,0,0,0,0,0,0,0,0,0,0,0,0,0,0,0,0,0,0,0,0,0,0,0,0,0,0,0,0,0,0,0,0,0,0,0,0,0,0,0,0,0,0,0,0,0,0,0,0,0,1,0
10235,115282.0,Chuckie Egg,"Chuckie Egg is an action platformer featuring a turn-based multiplayer mode. As Hen-House Harry, the player must collect the twelve eggs positioned in each level, before a countdown timer reaches zero. In addition there are piles of seed which may be collected to increase points and stop the countdown timer for a while. The player starts with five lives, and an extra life is awarded every 10,000 points.",1983.0,83.35,0,0,0,0,0,0,0,0,1,0,0,0,0,0,0,0,0,0,0,0,0,0,0,0,1,0,1,0,1,0,0,0,0,0,1,0,0,1,1,0,0,0,1,0,0,0,0,0,1,0,0,0,0,0,0,0,0,0,0,0,0,0,1,0,0,0,0,0,0,0,0,0,0,0,0,0,0,0,0,0,0,0,0,0,0,0,1,0,0,0,0,0,0,0,0,0,0,0,0,0,0,0,0,0,0,0,0,0,0,0,1,0,0,0,0,0,0,0,0,0,0,0,0,0,1,0,0,0,0,1,1,0
10496,103893.0,Wizardry: Bane of the Cosmic Forge,"Ten years ago, Wizardry set the standards in Fantasy Role-Playing (FRP). Now after two million copies have been sold and dozens of awards have been won, Bane of the Cosmic Forge raises and redefines those standards. This new Wizardry , the truest simulation ever of Fantasy Role Playing, will push your computer, your mind, and your sense of adventure to their very limits. Only through the power of the latest computer technology could the full dimensions of this new genre in FRP be possible.",1990.0,97.9,1,0,0,0,0,0,0,0,0,0,0,0,0,0,1,0,0,0,0,0,0,0,0,0,0,0,1,0,0,0,0,0,0,0,0,0,0,0,0,0,0,0,0,0,0,0,0,0,0,0,1,0,0,0,0,0,0,0,0,0,0,0,0,0,1,0,0,0,0,0,0,0,0,0,0,0,0,0,0,0,0,0,0,0,0,0,1,0,0,0,0,0,0,0,0,0,0,0,1,0,0,0,0,0,0,0,0,1,0,0,0,0,0,0,0,0,0,0,0,0,0,0,0,0,0,0,0,0,0,0,1,0
10578,17156.0,Myths Of Orion: Light from the North,"Long time ago, in a Realm of Orion, a powerful, but greedy wizard collected knowledge from all around the world. And thus came to write the three Books: books of knowledge, Law and Magic.The books gave him ultimate powers. But, he used them not to prosper, but for chaos! One day the mighty enchantress Salina gathered all of her strength and courage and stole the Books from the Wizard. Under the cover of a night, she took the Books and her child, baby Meredith, and ran far, far away to the North, to her sister Ariel’s house - at the very edge of the world. She could only hope the Wizard wouldn’t find them there. And so, the years and decades passed by... until one day...",2014.0,90.0,1,0,0,0,0,0,0,0,0,0,1,0,0,0,0,0,0,0,0,0,0,0,0,0,0,0,0,0,0,0,0,0,0,0,0,0,0,0,0,0,0,0,0,0,0,0,0,0,0,0,0,0,0,0,0,0,0,0,0,0,0,0,0,0,0,0,0,0,0,0,0,0,0,0,0,0,0,1,0,0,0,0,0,0,0,1,0,0,0,0,0,0,0,0,0,0,0,0,0,0,0,0,0,0,0,0,0,0,0,0,0,0,0,0,0,0,0,0,0,0,0,0,0,0,0,0,0,0,0,0,1,0
10583,84322.0,Nancy Drew: Shadow at the Water's Edge,"Nancy Drew heads for Japan where she’s staying at a traditional ryokan (inn) for a little R&R with Bess and George, but when reports of a vengeful ghost start scaring away the guests, Nancy’s vacation takes a turn for terror! It’ll be up to you, as Nancy Drew, to uncover the secret that lies beneath the surface, before the ghost can take its revenge! Dare to Play 
 
Nancy Drew: Shadow at the Water’s Edge is a first-person perspective, point-and-click adventure game. The player is Nancy Drew and has to solve a mystery. Explore rich environments for clues, interrogate suspects, and solve puzzles and mini-games.",2010.0,85.11,1,0,0,0,0,0,0,0,0,1,1,0,0,0,0,0,0,0,0,0,0,0,0,0,0,0,0,0,0,0,0,0,0,0,0,0,0,0,0,0,0,0,0,0,0,0,0,0,0,0,0,0,0,0,0,0,0,0,0,0,0,0,0,0,1,0,0,0,0,0,0,0,0,0,0,0,0,0,0,0,0,0,0,0,0,1,0,0,0,0,0,0,0,0,0,0,0,0,0,0,0,0,0,0,0,0,0,0,0,0,0,0,0,0,0,0,0,0,0,0,0,0,0,0,0,0,0,0,0,0,1,0
10760,112131.0,Bloodstained: Ritual of the Night,"Bloodstained: Ritual of the Night is an exploration-focused, side-scroller action RPG by Koji Igarashi. Play as Miriam, an orphan scarred by an alchemist's curse that slowly crystallizes her body. Battle through a demon-infested castle and defeat its master to save yourself, and all of humanity!",2019.0,83.86,1,0,0,0,0,0,0,0,1,0,0,0,0,0,1,0,0,0,0,0,0,0,0,0,0,0,0,0,0,0,0,0,0,0,0,0,0,0,0,0,0,0,0,0,0,0,0,0,0,0,0,0,0,0,0,0,0,0,1,0,0,0,0,0,0,0,0,0,0,0,0,0,0,0,0,0,0,1,0,0,0,0,0,0,0,1,0,0,0,0,0,0,1,0,0,0,0,0,0,0,0,0,0,0,0,0,0,0,0,0,0,0,0,0,0,0,0,0,0,0,0,0,1,0,0,1,0,1,0,1,1,0
10951,187377.0,Tales from the Dragon Mountain 2: The Lair,"It has been years since brave Mina Lockheart defeated Lord Strix. But dark shadows are rising once again! Spirits are restless! For he has awaken! Evil Lord Strix is breeding a new army to enslave all creatures from the Dragon Mountains!

It is once again up to Mina and her best friend spirit Malik to travel to distant parts of the world and find clues how to open the passage to a hidden wasteland - Lord Strix's lair. Meet different characters along your journey, help them and have them help you. Search and discover new places, but hurry! Lord Strix gets stronger by the minute!",2014.0,90.0,1,0,0,0,0,0,0,0,0,0,1,0,0,0,0,0,0,0,0,0,0,0,0,0,0,0,0,0,0,0,0,0,0,0,0,0,0,0,0,0,0,0,0,0,0,0,0,0,0,0,0,0,0,0,0,0,0,0,0,0,0,0,0,0,1,0,0,0,0,0,0,0,0,0,0,0,0,1,0,0,0,0,0,0,0,1,0,0,0,0,0,0,0,0,0,0,0,0,0,0,0,0,0,0,0,0,0,0,0,0,0,0,0,0,0,0,0,0,0,0,0,0,0,0,0,0,0,0,0,0,1,0
11051,103128.0,Mushihimesama,"Mushihimesama is a manic shooter developed by Cave and released by Taito in 2004. It was ported to the PlayStation 2 in 2005 and iOS in 2011. An Xbox 360 port was released in May 2012 (with ver1.5 as first print DLC). A significantly changed ""version 1.5"" was released to arcades in 2011. The game has an insect theme as all of the enemies resemble various insects such as beetles and butterflies. The game is set in various forest environments. It received a sequel in 2006, known as Mushihimesama Futari, and a spin-off iOS game entitled Mushihimesama Bug Panic.",2004.0,86.17,0,1,0,0,0,0,0,0,0,0,0,0,0,0,0,1,0,0,0,0,0,0,0,0,0,0,0,0,0,0,0,0,1,0,0,0,0,0,0,0,0,0,0,0,0,0,0,0,0,0,0,0,0,0,0,0,0,0,0,0,0,0,0,0,0,0,0,0,0,0,0,0,0,0,0,0,0,0,0,0,0,0,0,0,0,0,0,0,0,0,1,0,0,0,0,0,0,0,0,0,0,0,0,0,0,0,0,0,0,0,0,0,0,0,0,0,0,0,0,0,0,0,0,0,0,1,0,0,0,1,1,0
11118,82046.0,Dishonored 2,"Reprise your role as a supernatural assassin in Dishonored 2. Play your way in a world where mysticism and industry collide. Will you choose to play as Empress Emily Kaldwin or the Royal Protector, Corvo Attano? Will you stalk your way through the game unseen, make full use of its brutal combat system, or use a blend of both? How will you combine your character’s unique set of powers, weapons and gadgets to eliminate your enemies? The story responds to your choices, leading to intriguing outcomes, as you play through each of the game’s hand-crafted missions.",2016.0,85.97,1,0,0,0,0,0,0,0,0,0,0,0,0,0,1,1,0,0,0,0,0,0,0,0,0,0,0,0,0,0,0,0,0,0,0,0,0,0,0,0,0,0,0,0,0,0,0,0,0,0,0,0,0,0,0,0,0,0,0,0,0,0,0,0,0,0,0,0,0,0,0,0,0,0,0,0,0,0,0,0,0,0,0,0,0,1,0,0,0,0,0,0,1,0,0,0,0,0,0,0,0,0,0,0,0,0,0,0,0,0,0,0,0,0,0,0,0,0,0,0,0,0,1,0,0,0,0,0,0,0,1,0
11133,87279.0,Dark Souls III,"Dark Souls continues to push the boundaries with the latest, ambitious chapter in the critically-acclaimed and genre-defining series. Prepare yourself and embrace the darkness!",2016.0,87.64,1,0,0,0,0,0,0,0,0,0,0,0,0,0,1,0,0,0,0,0,0,0,0,0,0,0,0,0,0,0,0,0,0,0,0,0,0,0,0,0,0,0,0,0,0,0,0,0,0,0,0,0,0,0,0,0,0,0,0,0,0,0,0,0,0,0,0,0,0,0,0,0,0,0,0,0,0,0,0,0,0,0,0,0,0,1,0,0,0,0,0,0,1,0,0,0,0,0,0,0,0,0,0,0,0,0,0,0,0,0,0,0,0,0,0,0,0,0,0,0,0,0,1,0,0,0,0,1,0,1,1,0
11156,133030.0,Horizon Zero Dawn,"Welcome to a vibrant world rich with the beauty of nature – but inhabited by awe-inspiring, highly advanced machines. As a young machine hunter named Aloy, you must unravel the mysteries of this world and find your own destiny.",2017.0,90.84,1,0,0,0,0,0,0,0,0,0,0,0,0,0,1,1,0,0,0,0,0,0,0,0,0,0,0,0,0,0,0,0,0,0,0,0,0,0,0,0,0,0,0,0,0,0,0,0,0,0,0,0,0,0,0,0,0,0,0,0,0,0,0,0,0,0,0,0,0,0,0,0,0,0,0,0,0,0,0,0,0,0,0,0,0,1,0,0,0,0,0,0,1,0,0,0,0,0,0,0,0,0,0,0,0,0,0,0,0,0,0,0,0,0,0,0,0,0,0,0,0,0,0,0,0,0,0,0,0,0,1,0
11208,114200.0,NieR: Automata,"NieR: Automata tells the story of androids 2B, 9S and A2 and their battle to reclaim the machine-driven dystopia overrun by powerful machines.",2017.0,91.19,0,0,0,0,1,0,0,0,0,0,0,0,0,0,1,0,0,0,0,0,0,0,0,0,0,0,0,0,0,0,0,0,0,0,0,0,0,0,0,0,0,0,0,0,0,0,0,0,0,0,0,0,0,0,0,0,0,0,0,0,0,0,0,0,0,0,0,0,0,0,0,0,0,0,0,0,0,0,0,0,0,0,0,0,0,1,0,0,0,0,0,0,1,0,0,0,0,0,0,0,0,0,0,0,0,0,0,0,0,0,0,0,0,0,0,0,0,0,0,0,0,0,0,0,0,0,0,0,0,0,1,0
11210,85649.0,Star Ocean: The Second Story,"The first ""Star Ocean"" released outside of Japan. It was later re-released on the PSP under the name ""Star Ocean: Second Evolution"".",1998.0,89.39,1,0,0,0,0,0,0,0,0,0,0,0,0,0,1,0,0,0,0,0,0,0,0,0,0,0,0,0,0,0,0,0,0,0,0,0,0,0,0,0,0,0,0,0,0,0,0,0,0,0,0,0,0,0,0,0,0,0,0,0,0,0,0,0,0,0,0,0,0,0,0,0,0,0,0,0,0,0,0,0,0,0,0,0,0,0,0,0,0,1,0,0,0,0,0,0,0,0,0,0,0,0,0,0,0,0,0,0,0,0,0,0,0,0,0,0,0,0,0,0,0,0,0,0,0,0,0,0,0,0,1,0
11212,79111.0,Star Ocean: Till the End of Time,"Released as ""Star Ocean 3: Till the End of Time"" in 2003 by Enix before they merged with Squaresoft, the game was re-released under the name ""Star Ocean: Till the End of Time"" as a remastered version by Square Enix in 2004.",2003.0,83.85,1,0,0,0,0,0,0,0,0,0,0,0,0,0,1,0,0,0,0,0,0,0,0,0,0,0,0,0,0,0,0,0,0,0,0,0,0,0,0,0,0,0,0,0,0,0,0,0,0,0,0,0,0,0,0,0,0,0,0,0,0,0,0,0,0,0,0,0,0,0,0,0,0,0,0,0,0,0,0,0,0,0,0,0,0,0,0,0,0,0,1,0,1,0,0,0,0,0,0,0,0,0,0,0,0,0,0,0,0,0,0,0,0,0,0,0,0,0,0,0,0,0,0,0,0,0,0,0,0,0,1,0
11222,165225.0,Windjammers,"Windjammers (also known as Flying Power Disc in Japan) is a fast paced sports arcade game released by Data East on the Neo Geo arcade system in 1994 and later on the Wii Virtual Console in Japan on June 22, 2010. Following the bankruptcy of Data East, the intellectual rights for this game were acquired by Paon.It was delisted in Japanese Virtual Console for the Wii on December 24, 2013, making it the only delisted Neo-Geo game for the Wii Virtual Console.

The game mechanics are essentially the same as Pong or air hockey, where players continuously shoot the disc at the goal zone of the opponent attempting to score. The game can be played against the computer or in a 2 player versus.",1994.0,83.39,0,1,0,1,0,0,0,0,0,0,0,0,0,0,0,0,0,1,0,0,0,0,0,0,0,0,0,0,0,0,0,0,0,0,0,0,0,0,0,0,0,0,0,0,0,0,0,0,0,0,0,0,0,0,0,0,0,0,0,0,0,0,0,0,0,0,0,1,1,1,0,0,0,0,0,0,0,1,0,0,0,0,0,0,0,0,0,0,0,0,0,0,1,0,0,0,1,0,0,0,0,0,0,0,0,0,0,0,0,0,0,0,0,0,0,0,0,0,0,0,0,0,0,0,0,0,0,0,0,1,1,0
11226,10508.0,Anstoss 3,"2000 wurde mit Anstoss 3 die zweite Fortsetzung veröffentlicht. Innerhalb eines Jahres verkaufte es sich mehr als 200.000 Mal. Von den Spielemagazinen wurde es mit guten Wertungen bedacht (z. B. PC Player 87 %, Gamestar 88 %, PC Games 86 %).
Jedoch war es zu Beginn geradezu gefüllt mit Bugs, was von der Spielergemeinde kritisiert wurde. Dennoch wurde es von den Anstoss-Fans mit Begeisterung aufgenommen, da es die wichtigsten Elemente von Anstoss 2 Gold enthielt und diese noch weiter vertiefen konnte.
Als besonders gelungen gilt die 3D-Spieldarstellung. Der Spieler konnte sich ein komplettes Spiel seines Teams reduziert auf neun Minuten ansehen. Auch der Szenenmodus galt als revolutionär, da die Szenen nicht, wie in den Vorgängerteilen, vorberechnet wurden. Kommentiert wurden die Spielszenen durch den bekannten Fußballkommentator Günther Koch.
Auch neu war die Umsetzung des Vereinsgeländes. Von Apfelbäumen über Konditionsparcours und Doping-Labor bis hin zu Wolkenkratzern konnte der Spieler sein Vereinsgelände mit Gebäuden, Gegenständen und Lebewesen mit und ohne Nutzen erweitern.
Mit der Veröffentlichung des finalen Patches auf Version 1.40 wurde es nahezu bugfrei und konnte die Anstoss-Spieler überzeugen. Insgesamt wurden bis heute über eine Million Exemplare von Anstoss 3 verkauft und machen es damit zu einem der erfolgreichsten PC-Spiele Deutschlands. Trotz seines Alters wird Anstoss 3 durch die große Spieltiefe zusammen mit einem gelungenen Text- und 3D-Modus als bester Teil der Anstoss-Reihe angesehen. Dass Anstoss 3 auch heute noch sehr beliebt ist, hängt auch mit dem Multiplayermodus zusammen. So wird es bis zu 4 Spielern ermöglicht, im Netzwerk gegeneinander anzutreten.",2000.0,99.63,0,0,0,0,0,0,0,0,0,0,0,0,0,0,0,0,1,1,0,0,0,0,0,0,0,0,0,0,0,0,0,0,0,0,0,0,0,0,0,0,0,0,0,0,0,0,0,0,0,0,0,0,0,0,0,0,0,0,0,0,0,0,0,0,0,0,0,0,0,0,0,0,0,0,0,0,0,0,0,0,0,0,0,0,0,1,0,0,0,0,0,0,0,0,0,0,0,0,0,0,0,0,0,0,0,0,0,0,0,0,0,0,0,0,0,0,0,0,0,0,0,0,0,0,0,0,0,0,0,1,1,0
11227,154796.0,Trials of Mana,"Seiken Densetsu 3 is a 1995 action role-playing game developed and published by Square (now Square Enix) for the Super Nintendo Entertainment System. It is the sequel to the 1993 game Seiken Densetsu 2 (released outside Japan as Secret of Mana), and is the third game in the Mana series.",1995.0,85.67,0,0,0,0,0,0,0,0,1,0,0,0,0,0,1,1,0,0,0,0,0,0,0,0,0,0,0,0,0,0,0,0,0,0,0,0,0,0,0,0,0,0,0,0,0,0,0,0,0,0,0,0,0,0,0,0,0,0,0,0,0,0,0,0,0,0,0,0,0,0,0,0,0,0,0,0,0,0,0,0,0,0,0,0,0,0,0,0,0,0,0,0,0,0,0,0,0,0,1,0,0,0,0,0,0,0,0,1,1,0,0,0,0,0,0,0,0,0,0,0,0,0,0,0,0,0,0,0,0,1,1,0
