,Game Info,Game Info,Game Info,Game Info,Game Info,Genre,Genre,Genre,Genre,Genre,Genre,Genre,Genre,Genre,Genre,Genre,Genre,Genre,Genre,Genre,Genre,Genre,Genre,Genre,Genre,Genre,Genre,Platform,Platform,Platform,Platform,Platform,Platform,Platform,Platform,Platform,Platform,Platform,Platform,Platform,Platform,Platform,Platform,Platform,Platform,Platform,Platform,Platform,Platform,Platform,Platform,Platform,Platform,Platform,Platform,Platform,Platform,Platform,Platform,Platform,Platform,Platform,Platform,Platform,Platform,Platform,Platform,Platform,Platform,Platform,Platform,Platform,Platform,Platform,Platform,Platform,Platform,Platform,Platform,Platform,Platform,Platform,Platform,Platform,Platform,Platform,Platform,Platform,Platform,Platform,Platform,Platform,Platform,Platform,Platform,Platform,Platform,Platform,Platform,Platform,Platform,Platform,Platform,Platform,Platform,Platform,Platform,Platform,Platform,Platform,Platform,Platform,Platform,Platform,Platform,Platform,Platform,Platform,Platform,Platform,Platform,Platform,Platform,Platform,Platform,Platform,Platform,Platform,Platform,Platform,Platform,Game Mode,Game Mode,Game Mode,Game Mode,Game Mode,Game Mode
,Cover,Name,Summary,Release Year,Score Rating,Adventure,Arcade,Card & Board Game,Fighting,Hack and slash/Beat 'em up,Indie,Music,Pinball,Platform,Point-and-click,Puzzle,Quiz/Trivia,Racing,Real Time Strategy (RTS),Role-playing (RPG),Shooter,Simulator,Sport,Strategy,Tactical,Turn-based strategy (TBS),Visual Novel,3DO Interactive Multiplayer,Acorn Archimedes,Acorn Electron,Amazon Fire TV,Amiga,Amiga CD32,Amstrad CPC,Android,Apple II,Apple IIGS,Arcade Platform,Atari 2600,Atari 8-bit,Atari Jaguar,Atari Lynx,Atari ST/STE,BBC Microcomputer System,BlackBerry OS,ColecoVision,Commodore 16,Commodore C64/128,Commodore VIC-20,DUPLICATE Stadia,DVD Player,Daydream,Donner Model 30,Dragon 32/64,Dreamcast,FM Towns,FM-7,Family Computer,Family Computer Disk System,Game Boy,Game Boy Advance,Game Boy Color,Gear VR,Google Stadia,Intellivision,Legacy Mobile Device,Linux,MSX,MSX2,Mac,N-Gage,NEC PC-6000 Series,Neo Geo AES,Neo Geo CD,Neo Geo MVS,New Nintendo 3DS,Nintendo 3DS,Nintendo 64,Nintendo DS,Nintendo DSi,Nintendo Entertainment System (NES),Nintendo GameCube,Nintendo Switch,OOParts,Oculus Quest,Oculus Quest 2,Oculus Rift,Oculus VR,OnLive Game System,Ouya,PC (Microsoft Windows),PC DOS,PC-8801,PC-98,PlayStation,PlayStation 2,PlayStation 3,PlayStation 4,PlayStation 5,PlayStation Portable,PlayStation VR,PlayStation Vita,S,Satellaview,Sega CD,Sega Game Gear,Sega Master System,Sega Mega Drive/Genesis,Sega Saturn,Sharp X1,Sharp X68000,SteamVR,Super Famicom,Super Nintendo Entertainment System (SNES),Tapwave Zodiac,Tatung Einstein,TurboGrafx-16/PC Engine,Turbografx-16/PC Engine CD,Web browser,Wii,Wii U,Windows Mixed Reality,Windows Phone,WonderSwan,WonderSwan Color,Xbox,Xbox 360,Xbox One,Xbox Series X,ZX Spectrum,iOS,Battle Royale,Co-operative,Massively Multiplayer Online (MMO),Multiplayer,Single player,Split screen
id,,,,,,,,,,,,,,,,,,,,,,,,,,,,,,,,,,,,,,,,,,,,,,,,,,,,,,,,,,,,,,,,,,,,,,,,,,,,,,,,,,,,,,,,,,,,,,,,,,,,,,,,,,,,,,,,,,,,,,,,,,,,,,,,,,,,,,,,,
1,90967.0,Thief II: The Metal Age,"The ultimate thief is back! Tread softly as you make your way through 15 new complex, non-linear levels full of loot to steal and guards to outsmart. Improved enemy AI, new gadgets and a riveting story will draw you into the world of Thief II: The Metal Age, a place of powerful new technologies, fanatical religions and corruption.",2000.0,89.26,1,0,0,0,0,0,0,0,0,0,0,0,0,0,0,1,1,0,0,0,0,0,0,0,0,0,0,0,0,0,0,0,0,0,0,0,0,0,0,0,0,0,0,0,0,0,0,0,0,0,0,0,0,0,0,0,0,0,0,0,0,0,0,0,0,0,0,0,0,0,0,0,0,0,0,0,0,0,0,0,0,0,0,0,0,1,0,0,0,0,0,0,0,0,0,0,0,0,0,0,0,0,0,0,0,0,0,0,0,0,0,0,0,0,0,0,0,0,0,0,0,0,0,0,0,0,0,0,0,0,1,0
2,96746.0,Thief: The Dark Project,"Thief is a first-person stealth game that likes the dark. You sneak through the ruins of haunted cathedrals, subterranean ruins, and forbidding prisons, in a dark and sinister city - heavily inspired by Steampunk and the Dark Ages. Garrett finds an ally in the shadows, as he steals for money and uncovers the hidden agendas of allies and enemies. The story that unravels is one of deception and revenge.",1998.0,78.28,1,0,0,0,0,0,0,0,0,0,0,0,0,0,0,0,1,0,0,0,0,0,0,0,0,0,0,0,0,0,0,0,0,0,0,0,0,0,0,0,0,0,0,0,0,0,0,0,0,0,0,0,0,0,0,0,0,0,0,0,0,0,0,0,0,0,0,0,0,0,0,0,0,0,0,0,0,0,0,0,0,0,0,0,0,1,0,0,0,0,0,0,0,0,0,0,0,0,0,0,0,0,0,0,0,0,0,0,0,0,0,0,0,0,0,0,0,0,0,0,0,0,0,0,0,0,0,0,0,0,1,0
5,93899.0,Baldur's Gate,"Baldur's Gate is a fantasy role-playing video game developed by BioWare and published in 1998 by Interplay Entertainment. It is the first game in the Baldur's Gate series and takes place in the Forgotten Realms, a high fantasy campaign setting, using a modified version of the Advanced Dungeons & Dragons (AD&D) 2nd edition rules. It was the first game to use the Infinity Engine for its graphics, with Interplay using the engine for other Forgotten Realms-licensed games, including the Icewind Dale series, as well as other licensed D&D campaign worlds such as Planescape: Torment. The game's story focuses on players controlling a protagonist of their own creation who finds themselves travelling across the Sword Coast alongside a party of companions, to unravel the mystery surrounding a sudden iron crisis affecting the region and attempting to discover the culprits behind it, all while uncovering dark secrets about their origins and dealing with attempts on their life.",1998.0,87.07,0,0,0,0,0,0,0,0,0,0,0,0,0,0,1,0,0,0,0,0,0,0,0,0,0,0,0,0,0,0,0,0,0,0,0,0,0,0,0,0,0,0,0,0,0,0,0,0,0,0,0,0,0,0,0,0,0,0,0,0,0,1,0,0,1,0,0,0,0,0,0,0,0,0,0,0,0,0,0,0,0,0,0,0,0,1,0,0,0,0,0,0,0,0,0,0,0,0,0,0,0,0,0,0,0,0,0,0,0,0,0,0,0,0,0,0,0,0,0,0,0,0,0,0,0,1,0,1,0,0,1,0
6,90896.0,Baldur's Gate II: Shadows of Amn,"Every World has conflict. Good and evil. Friend and foe. Safety and danger. In Baldur's Gate II: Shadows of Amn, you'll find yourself between these factions. This epic sequel to the Roleplaying Game of the Year will immerse you in a world of intrigue, adventure and fierce combat where your ability to discern the difference between these sides - with the assistance of steel and spell - determines your fate. Set in the Forgotten Realms campaign setting, Baldur's Gate II is the most stunning Advanced Dungeons and Dragons game to date.",2000.0,89.94,0,0,0,0,0,0,0,0,0,0,0,0,0,0,1,0,0,0,0,0,0,0,0,0,0,0,0,0,0,0,0,0,0,0,0,0,0,0,0,0,0,0,0,0,0,0,0,0,0,0,0,0,0,0,0,0,0,0,0,0,0,1,0,0,1,0,0,0,0,0,0,0,0,0,0,0,0,0,0,0,0,0,0,0,0,1,0,0,0,0,0,0,0,0,0,0,0,0,0,0,0,0,0,0,0,0,0,0,0,0,0,0,0,0,0,0,0,0,0,0,0,0,0,0,0,0,0,1,0,0,1,0
9,104633.0,Jagged Alliance 2,"A ruthless dictator has taken control of the tiny nation of Arulco. The country’s brutal army is holding the terrified population in its iron grip. The only opposition is a ragtag bunch of rebels. The bad news: you’re in charge of the rebels. The good news: some of the world’s best mercenaries will fight on your side... that is if you can afford them.

Jagged Alliance 2 features: perfect blend of strategy, roleplaying and tactical combat; dozen of new weapons; 150+ individual in-game characters; realistic combat physics; and more than 10,000 lines of digitalized speech. The only thing missing is YOU.

Welcome to the killing grounds!",1999.0,86.15,1,0,0,0,0,0,0,0,0,0,0,0,0,0,1,0,0,0,1,1,1,0,0,0,0,0,1,0,0,0,0,0,0,0,0,0,0,0,0,0,0,0,0,0,0,0,0,0,0,0,0,0,0,0,0,0,0,0,0,0,0,1,0,0,0,0,0,0,0,0,0,0,0,0,0,0,0,0,0,0,0,0,0,0,0,1,0,0,0,0,0,0,0,0,0,0,0,0,0,0,0,0,0,0,0,0,0,0,0,0,0,0,0,0,0,0,0,0,0,0,0,0,0,0,0,0,0,0,0,0,1,0
11,123160.0,Vampire: The Masquerade - Bloodlines,"A first- and third-person Western RPG based on the Vampire: The Masquerade tabletop RPG with a heavy emphasis on character building and role-playing, in which the player embodies a fledgling vampire under the guidance of vampire prince Sebastian LaCroix. The player must serve the prince while getting to know the various factions of vampires in Los Angeles and forming their own political views.",2004.0,79.91,0,0,0,0,0,0,0,0,0,0,0,0,0,0,1,0,0,0,0,0,0,0,0,0,0,0,0,0,0,0,0,0,0,0,0,0,0,0,0,0,0,0,0,0,0,0,0,0,0,0,0,0,0,0,0,0,0,0,0,0,0,0,0,0,0,0,0,0,0,0,0,0,0,0,0,0,0,0,0,0,0,0,0,0,0,1,0,0,0,0,0,0,0,0,0,0,0,0,0,0,0,0,0,0,0,0,0,0,0,0,0,0,0,0,0,0,0,0,0,0,0,0,0,0,0,0,0,0,0,0,1,0
13,91139.0,Fallout,"The Vault Dweller is tasked with exploring post-nuclear California in order to retrieve a water chip to replace the broken chip of Vault 13, their home, which they are the first person to ever leave. The player will engage in Western RPG character building and turn-based tactical combat while getting to know settlements and factions of people, mutants and ghouls through branching dialogue trees.",1997.0,86.9,0,0,0,0,0,0,0,0,0,0,0,0,0,0,1,0,0,0,0,0,1,0,0,0,0,0,0,0,0,0,0,0,0,0,0,0,0,0,0,0,0,0,0,0,0,0,0,0,0,0,0,0,0,0,0,0,0,0,0,0,0,0,0,0,1,0,0,0,0,0,0,0,0,0,0,0,0,0,0,0,0,0,0,0,0,1,1,0,0,0,0,0,0,0,0,0,0,0,0,0,0,0,0,0,0,0,0,0,0,0,0,0,0,0,0,0,0,0,0,0,0,0,0,0,0,0,0,0,0,0,1,0
14,202749.0,Fallout 2,"A turn-based tactical Western RPG in which the Chosen One is tasked with exploring post-nuclear California to locate and retrieve the fabled Garden of Eden Creation Kit for their famine-stricken tribe, while coming into contact through branching dialogue trees with numerous tribes, factions and micro-civilizations, each with their own virtues, vices, socioeconomic situations and political agendas.",1998.0,91.1,0,0,0,0,0,0,0,0,0,0,0,0,0,0,1,0,0,0,0,0,1,0,0,0,0,0,0,0,0,0,0,0,0,0,0,0,0,0,0,0,0,0,0,0,0,0,0,0,0,0,0,0,0,0,0,0,0,0,0,0,0,0,0,0,1,0,0,0,0,0,0,0,0,0,0,0,0,0,0,0,0,0,0,0,0,1,0,0,0,0,0,0,0,0,0,0,0,0,0,0,0,0,0,0,0,0,0,0,0,0,0,0,0,0,0,0,0,0,0,0,0,0,0,0,0,0,0,0,0,0,1,0
16,85752.0,Fallout: New Vegas,"In this first-person Western RPG, the player takes on the role of Courier 6, barely surviving after being robbed of their cargo, shot and put into a shallow grave by a New Vegas mob boss. The Courier sets out to track down their robbers and retrieve their cargo, and winds up getting tangled in the complex ideological and socioeconomic web of the many factions and settlements of post-nuclear Nevada.",2010.0,85.86,0,0,0,0,0,0,0,0,0,0,0,0,0,0,1,1,0,0,0,0,0,0,0,0,0,0,0,0,0,0,0,0,0,0,0,0,0,0,0,0,0,0,0,0,0,0,0,0,0,0,0,0,0,0,0,0,0,0,0,0,0,0,0,0,0,0,0,0,0,0,0,0,0,0,0,0,0,0,0,0,0,0,0,0,0,1,0,0,0,0,0,1,0,0,0,0,0,0,0,0,0,0,0,0,0,0,0,0,0,0,0,0,0,0,0,0,0,0,0,0,0,1,0,0,0,0,0,0,0,0,1,0
18,181838.0,Max Payne,"Max Payne, gritty ex-cop and titular hero of this third-person shooter, sets out on his own to take revenge on those who murdered his wife and child, only for the plot he's involved in to get deeper and deeper. As his guilt and trauma build, Payne finds himself in more and more impossibly unfavourable and astounding situations, which challenge his methods, his worldview, and even his existence.",2001.0,81.45,0,0,0,0,0,0,0,0,0,0,0,0,0,0,0,1,0,0,0,0,0,0,0,0,0,0,0,0,0,1,0,0,0,0,0,0,0,0,0,0,0,0,0,0,0,0,0,0,0,0,0,0,0,0,0,0,0,0,0,0,0,0,0,0,1,0,0,0,0,0,0,0,0,0,0,0,0,0,0,0,0,0,0,0,0,1,0,0,0,0,1,1,1,0,0,0,0,0,0,0,0,0,0,0,0,0,0,0,0,0,0,0,0,0,0,0,0,0,0,0,1,1,0,0,0,1,0,0,0,0,1,0
19,120981.0,Max Payne 2: The Fall of Max Payne,"Max Payne 2 is a third-person shooter, in which the player assumes the role of Max Payne, but also plays as Mona Sax in a few levels. Initially, the player's weapon is a 9mm pistol. As they progress, players access other weapons including other handguns, shotguns, submachine guns, assault rifles, sniper rifles, and hand-thrown weapons. To move the game along, the player is told what the next objective is through Max's internal monologue, in which Max iterates what his next steps should be.",2003.0,86.29,0,0,0,0,0,0,0,0,0,0,0,0,0,0,0,1,0,0,0,0,0,0,0,0,0,0,0,0,0,0,0,0,0,0,0,0,0,0,0,0,0,0,0,0,0,0,0,0,0,0,0,0,0,0,0,0,0,0,0,0,0,0,0,0,0,0,0,0,0,0,0,0,0,0,0,0,0,0,0,0,0,0,0,0,0,1,0,0,0,0,1,1,0,0,0,0,0,0,0,0,0,0,0,0,0,0,0,0,0,0,0,0,0,0,0,0,0,0,0,0,1,1,0,0,0,0,0,0,0,0,1,0
20,122598.0,BioShock,"Set in the steampunk Objectivist underwater dystopia of Rapture in the 1960's, Bioshock is a first-person shooter wherein the player arms and genetically modifies themselves in order to survive against the city's resident great minds-turned-maddened anomalies and aid a revolutionary leader named Atlas in overthrowing the city's ruling despot, Andrew Ryan.",2007.0,91.99,1,0,0,0,0,0,0,0,0,0,0,0,0,0,1,1,0,0,0,0,0,0,0,0,0,0,0,0,0,0,0,0,0,0,0,0,0,0,0,0,0,0,0,0,0,0,0,0,0,0,0,0,0,0,0,0,0,0,0,0,0,0,0,0,1,0,0,0,0,0,0,0,0,0,0,0,0,0,0,0,0,0,0,0,0,1,0,0,0,0,0,1,0,0,0,0,0,0,0,0,0,0,0,0,0,0,0,0,0,0,0,0,0,0,0,0,0,0,0,0,0,1,0,0,0,1,0,0,0,0,1,0
22,201260.0,System Shock 2,"A first-person cyberpunk exploratory horror RPG and sequel to System Shock (1994) in which a soldier wakes up in the starship Van Braun in the aftermath of a disaster and finds himself in the midst of a conflict between SHODAN, the artificial intelligence antagonist of System Shock seeking mastery over humanity, and The Many, a flesh-based psychic hive mind led by the ship's corrupted AI.",1999.0,90.15,0,0,0,0,0,0,0,0,0,0,0,0,0,0,1,1,0,0,0,0,0,0,0,0,0,0,0,0,0,0,0,0,0,0,0,0,0,0,0,0,0,0,0,0,0,0,0,0,0,0,0,0,0,0,0,0,0,0,0,0,0,0,0,0,1,0,0,0,0,0,0,0,0,0,0,0,0,0,0,0,0,0,0,0,0,1,0,0,0,0,0,0,0,0,0,0,0,0,0,0,0,0,0,0,0,0,0,0,0,0,0,0,0,0,0,0,0,0,0,0,0,0,0,0,0,0,0,1,0,0,1,0
23,204916.0,System Shock,"A seminal cyberpunk first-person exploratory adventure game with RPG elements in which, waking up in the Citadel Space Station, a lone hacker has to survive corrupted enemies and collect audio logs and equipment from former station workers in order to shut down SHODAN, the station's artificial intelligence that has killed everyone on board and now intends to destroy the world.",1994.0,91.19,0,0,0,0,0,0,0,0,0,0,0,0,0,0,1,1,0,0,0,0,0,0,0,0,0,0,0,0,0,0,0,0,0,0,0,0,0,0,0,0,0,0,0,0,0,0,0,0,0,0,0,0,0,0,0,0,0,0,0,0,0,0,0,0,1,0,0,0,0,0,0,0,0,0,0,0,0,0,0,0,0,0,0,0,0,0,1,0,0,0,0,0,0,0,0,0,0,0,0,0,0,0,0,0,0,0,0,0,0,0,0,0,0,0,0,0,0,0,0,0,0,0,0,0,0,0,0,0,0,0,1,0
24,114679.0,X-COM: UFO Defense,"You are in control of X-COM: an organization formed by the world's governments to fight the ever-increasing alien menace.

Shooting down UFOs is just the beginning: you must then lead a squad of heavily-armed soldiers across different terrains as they investigate the UFO crash site. Tackle the aliens with automatic rifles, rocket launchers, and even tanks in the struggle to retrieve useful technology, weapons or life forms.

Successful ground assault missions will allow X-COM scientists to analyze alien items. Each new breakthrough brings you a little closer to understanding the technology and culture of the alien races. Once you have sufficient research data on the UFO's superior weapons and crafts, you'll be able to manufacture weapons of equal capability.

You must make every crucial decision as you combat the powerful alien forces. But you'll also need to watch the world political situation: governments may be forced into secret pacts with the aliens and then begin to reduce X-COM funding.",1994.0,86.84,0,0,0,0,0,0,0,0,0,0,0,0,0,0,0,0,0,0,1,1,1,0,0,0,0,0,1,0,0,0,0,0,0,0,0,0,0,0,0,0,0,0,0,0,0,0,0,0,0,0,0,0,0,0,0,0,0,0,0,0,0,0,0,0,0,0,0,0,0,0,0,0,0,0,0,0,0,0,0,0,0,0,0,0,0,1,1,0,0,1,0,0,0,0,0,0,0,0,0,0,0,0,0,0,0,0,0,0,0,0,0,0,0,0,0,0,0,0,0,0,0,0,0,0,0,0,0,0,0,0,1,0
36,96742.0,Dungeon Keeper 2,"Like its predecessor, players take the role of a dungeon keeper, building and defending an underground dungeon from the would-be heroes that invade it, as well as from other keepers. In the game's campaign mode, the player is charged with recovering the portal gems from each area in order to open a portal to the surface.",1999.0,87.93,0,0,0,0,0,0,0,0,0,0,0,0,0,1,0,0,0,0,1,0,0,0,0,0,0,0,0,0,0,0,0,0,0,0,0,0,0,0,0,0,0,0,0,0,0,0,0,0,0,0,0,0,0,0,0,0,0,0,0,0,0,0,0,0,0,0,0,0,0,0,0,0,0,0,0,0,0,0,0,0,0,0,0,0,0,1,0,0,0,0,0,0,0,0,0,0,0,0,0,0,0,0,0,0,0,0,0,0,0,0,0,0,0,0,0,0,0,0,0,0,0,0,0,0,0,0,0,0,0,1,1,0
37,114332.0,Dead Space,"Dead Space is a 2008 science fiction survival horror video game developed by EA Redwood Shores (now Visceral Games) for Microsoft Windows, PlayStation 3 and Xbox 360. The game was released on all platforms through October 2008. The game puts the player in control of an engineer named Isaac Clarke, who battles the Necromorphs, reanimated human corpses, aboard an interstellar mining ship, the USG Ishimura.",2008.0,87.66,0,0,0,0,0,0,0,0,0,0,0,0,0,0,0,1,0,0,0,0,0,0,0,0,0,0,0,0,0,0,0,0,0,0,0,0,0,0,0,0,0,0,0,0,0,0,0,0,0,0,0,0,0,0,0,0,0,0,0,0,0,0,0,0,0,0,0,0,0,0,0,0,0,0,0,0,0,0,0,0,0,0,0,0,0,1,0,0,0,0,0,1,0,0,0,0,0,0,0,0,0,0,0,0,0,0,0,0,0,0,0,0,0,0,0,0,0,0,0,0,0,1,0,0,0,0,0,0,0,0,1,0
38,94526.0,Dead Space 2,"Three years after the Necromorph infestation aboard the USS Ishimura, Isaac Clarke awakens from a coma, confused, disoriented, and on a space station called The Sprawl. Just as his health begins to improve, The Sprawl is overrun with even more advanced forms of the alien-zombie hybrids.",2011.0,89.06,1,0,0,0,0,0,0,0,0,0,0,0,0,0,0,1,0,0,0,0,0,0,0,0,0,0,0,0,0,0,0,0,0,0,0,0,0,0,0,0,0,0,0,0,0,0,0,0,0,0,0,0,0,0,0,0,0,0,0,0,0,0,0,0,0,0,0,0,0,0,0,0,0,0,0,0,0,0,0,0,0,0,0,0,0,1,0,0,0,0,0,1,0,0,0,0,0,0,0,0,0,0,0,0,0,0,0,0,0,0,0,0,0,0,0,0,0,0,0,0,0,1,0,0,0,0,0,1,0,1,1,0
39,81353.0,Mafia,"Thomas ""Tommy"" Angelo, a taxi driver living in the 1930s in Lost Heaven (based on San Francisco and Chicago), enters a mafia gang led by Don Salieri and gets mixed up in a storyline including many plots, robberies and assassinations, later deciding to become an informant against the mob. Driven by third-person gunplay, realistic driving mechanics and advanced graphics, Mafia immerses the player into a real-world mobster story. 
 
Mafia contains a much bigger city to explore than most video games of the time, with multiple forms of available transport in addition to an expansive countryside. The game received positive reviews for the Windows version, with critics praising the game as a more realistic and serious Grand Theft Auto-styled game.",2002.0,76.0,1,0,0,1,0,0,0,0,0,0,0,0,1,0,0,1,0,0,0,0,0,0,0,0,0,0,0,0,0,0,0,0,0,0,0,0,0,0,0,0,0,0,0,0,0,0,0,0,0,0,0,0,0,0,0,0,0,0,0,0,0,0,0,0,0,0,0,0,0,0,0,0,0,0,0,0,0,0,0,0,0,0,0,0,0,1,0,0,0,0,1,0,0,0,0,0,0,0,0,0,0,0,0,0,0,0,0,0,0,0,0,0,0,0,0,0,0,0,0,0,1,0,0,0,0,0,0,0,0,0,1,0
41,81923.0,Deus Ex,"A philosophical first-person WRPG set in a dystopian 2052 in which JC Denton, a nano-augmented agent for the anti-terrorist organization UNATCO, is tasked with stopping the invasion of Liberty Island by the terrorist group NSF. As events unfold, Denton finds that he plays a large part in a world-spanning conspiracy which forces him to ponder his allegiances, beliefs, morality, and view of right and wrong.",2000.0,89.77,0,0,0,0,0,0,0,0,0,0,0,0,0,0,1,1,0,0,0,0,0,0,0,0,0,0,0,0,0,0,0,0,0,0,0,0,0,0,0,0,0,0,0,0,0,0,0,0,0,0,0,0,0,0,0,0,0,0,0,0,0,0,0,0,1,0,0,0,0,0,0,0,0,0,0,0,0,0,0,0,0,0,0,0,0,1,0,0,0,0,1,1,0,0,0,0,0,0,0,0,0,0,0,0,0,0,0,0,0,0,0,0,0,0,0,0,0,0,0,0,0,0,0,0,0,0,0,0,0,0,1,0
56,120073.0,The Elder Scrolls III: Morrowind,"First-person WRPG and third mainline entry in the Elder Scrolls franchise in which the player arrives in the island of Vvardenfell, an exotic land plagued by disease-carrying storms and ruled by a godly Tribunal, in the Morrowind province of Tamriel, and takes part in the prophecy foretelling the second coming of Nerevar, who will supposedly save Morrowind from malicious clans both within and outside Vvardenfell.",2002.0,85.71,1,0,0,0,0,0,0,0,0,0,0,0,0,0,1,0,0,0,0,0,0,0,0,0,0,0,0,0,0,0,0,0,0,0,0,0,0,0,0,0,0,0,0,0,0,0,0,0,0,0,0,0,0,0,0,0,0,0,0,0,0,0,0,0,0,0,0,0,0,0,0,0,0,0,0,0,0,0,0,0,0,0,0,0,0,1,0,0,0,0,0,0,0,0,0,0,0,0,0,0,0,0,0,0,0,0,0,0,0,0,0,0,0,0,0,0,0,0,0,0,1,0,0,0,0,0,0,0,0,0,1,0
59,84680.0,The Elder Scrolls IV: Oblivion,"The Elder Scrolls IV: Oblivion, the fourth game in the Elder Scrolls story, is set within the province of Cyrodiil, the heartland and Imperial capital of Tamriel. Emperor Uriel Septim VII is assassinated in flight from his own palace, but just before he dies he passes on to you the mystic Amulet of Kings. The adventure proper begins with the quest to find Uriel's lost and illegitimate son who is the only heir to the throne. In a world where the forces of darkness seek their ultimate dominion over the ranks of man and mer alike, you alone stand between the future of Tamriel and the gates of Oblivion.",2006.0,90.89,1,0,0,0,0,0,0,0,0,0,0,0,0,0,1,0,0,0,0,0,0,0,0,0,0,0,0,0,0,0,0,0,0,0,0,0,0,0,0,0,0,0,0,0,0,0,0,0,0,0,0,0,0,0,0,0,0,0,0,0,0,0,0,0,0,0,0,0,0,0,0,0,0,0,0,0,0,0,0,0,0,0,0,0,0,1,0,0,0,0,0,1,0,0,0,0,0,0,0,0,0,0,0,0,0,0,0,0,0,0,0,0,0,0,0,0,0,0,0,0,0,1,0,0,0,0,0,0,0,0,1,0
60,104101.0,The Secret of Monkey Island,"I cursed my luck again as I slid down the monkey's throat. Have my dreams of guzzling grog and plundering galleons been reduced to this? ""Three small trials and you're a pirate like us,"" they said. Fair enough. If only I could stomach the foul brew these scurvy seadogs swilled, the rest would be easy. How could I have known I'd meet a powerful and beautiful woman with a jealous suitor too stupid to realize he'd been dead for years? And how can I crawl through this great stone monkey to find a man who walks three inches above the ground and sets fire to his beard every morning?

Do business with quaint and humble shopkeepers. Participate in complex and meaningful dialogues. Visit interesting places and steal stuff. Experience the never-ending nightlife of Melee Island.",1990.0,83.63,1,0,0,0,0,0,0,0,0,1,1,0,0,0,0,0,0,0,0,0,0,0,0,0,0,0,1,0,0,0,0,0,0,0,0,0,0,1,0,0,0,0,0,0,0,0,0,0,0,0,1,0,0,0,0,0,0,0,0,0,0,0,0,0,1,0,0,0,0,0,0,0,0,0,0,0,0,0,0,0,0,0,0,0,0,0,1,0,0,0,0,0,0,0,0,0,0,0,0,1,0,0,0,0,0,0,0,0,0,0,0,0,0,0,0,0,0,0,0,0,0,0,0,0,0,0,0,0,0,0,1,0
61,141219.0,Monkey Island 2: LeChuck's Revenge,"Wannabe pirate Guybrush Threepwood, and the now zombie pirate LeChuck, return in what has long been considered one of the greatest LucasArts adventure games of all time.

Having seemingly defeated the evil ghost pirate LeChuck in his first adventure, Guybrush Threepwood sets his sights on the legendary treasure of Big Whoop. But wait, LeChuck is now back in zombie form and he's out for revenge. Guybrush will have to use his wits, his humor and his insatiable desire for adventure to defeat his nemesis once and for all and truly prove himself the greatest pirate in the Caribbean. Voodoo dolls, spitting contests and amusement parks are just some of the challenges Guybrush must overcome as he meets old friends, fights new enemies and uses every ounce of his mojo to overcome the wrath of LeChuck's revenge.",1991.0,90.47,1,0,0,0,0,0,0,0,0,1,1,0,0,0,0,0,0,0,0,0,0,0,0,0,0,0,1,0,0,0,0,0,0,0,0,0,0,0,0,0,0,0,0,0,0,0,0,0,0,0,0,0,0,0,0,0,0,0,0,0,0,0,0,0,1,0,0,0,0,0,0,0,0,0,0,0,0,0,0,0,0,0,0,0,0,0,1,0,0,0,0,0,0,0,0,0,0,0,0,0,0,0,0,0,0,0,0,0,0,0,0,0,0,0,0,0,0,0,0,0,0,0,0,0,0,0,0,0,0,0,1,0
62,141222.0,The Curse of Monkey Island,"Select from a variety of buccaneer hairstyles at The Barbery Coast. Enjoy a warm reunion with an old flame. Piracy never looked so good!

Learn a valuable trade in lighthouse and VCR repair. Loot, sack and pillage this quaint Caribbean hamlet. Third in the legendary Monkey Island series of graphic adventures.

Film quality animation, voice, sound and music- the undead come to life before your very eyes! Incredible high-resolution (640 x 480) graphics. A barrel of gameplay- estimated 30-plus hours.

Two difficulty settings: regular and Mega-Monkey (now with much more puzzley goodness)!

New and improved insults suitable for swordfights and other fun occasions!",1997.0,85.87,1,0,0,0,0,0,0,0,0,1,1,0,0,0,0,0,0,0,0,0,0,0,0,0,0,0,0,0,0,0,0,0,0,0,0,0,0,0,0,0,0,0,0,0,0,0,0,0,0,0,0,0,0,0,0,0,0,0,0,0,0,0,0,0,0,0,0,0,0,0,0,0,0,0,0,0,0,0,0,0,0,0,0,0,0,1,0,0,0,0,0,0,0,0,0,0,0,0,0,0,0,0,0,0,0,0,0,0,0,0,0,0,0,0,0,0,0,0,0,0,0,0,0,0,0,0,0,0,0,0,1,0
67,205481.0,Master of Orion,"Master of Orion is a competitive game of interstellar conquest that combines exploration with conflict. You are cast as the immortal emperor who shapes the future of your race, as contact is made with the neighbouring races. Your objective is simple: control a majority of the known galaxy and eliminate all who stand in the way.

As ruler you must ultimately decide the destiny of your race as you make decisions on how planetary resources are allocated, where star fleets will be deployed, which races to fight, and which races to ally with. You begin with control of your home planet, from which you can explore and colonize nearby star systems. Your first decisions will centre around the rapid development of colonies into productive worlds, what types of technology to focus on, and which star systems to colonize.

However, the true challenge begins when contact is made with other races, and complex strategies must be formulated to manage diplomacy, sabotage, espionage, trade, and interstellar combat.",1993.0,87.16,0,0,0,0,0,0,0,0,0,0,0,0,0,0,0,0,0,0,1,0,1,0,0,0,0,0,0,0,0,0,0,0,0,0,0,0,0,0,0,0,0,0,0,0,0,0,0,0,0,0,0,0,0,0,0,0,0,0,0,0,0,0,0,0,1,0,0,0,0,0,0,0,0,0,0,0,0,0,0,0,0,0,0,0,0,0,1,0,0,0,0,0,0,0,0,0,0,0,0,0,0,0,0,0,0,0,0,0,0,0,0,0,0,0,0,0,0,0,0,0,0,0,0,0,0,0,0,0,0,1,1,0
68,113382.0,Master of Orion II: Battle at Antares,Master of Orion 2 also known as MOO2 is considered the classic 4x turn based strategy game set in space. The game has a kind of cult status and even by to days standards is still only matched in game play by very few of its competitors.,1996.0,90.51,0,0,0,0,0,0,0,0,0,0,0,0,0,0,0,0,0,0,1,0,1,0,0,0,0,0,0,0,0,0,0,0,0,0,0,0,0,0,0,0,0,0,0,0,0,0,0,0,0,0,0,0,0,0,0,0,0,0,0,0,0,0,0,0,1,0,0,0,0,0,0,0,0,0,0,0,0,0,0,0,0,0,0,0,0,1,1,0,0,0,0,0,0,0,0,0,0,0,0,0,0,0,0,0,0,0,0,0,0,0,0,0,0,0,0,0,0,0,0,0,0,0,0,0,0,0,0,0,0,1,1,0
